ID,url,Title,Total Comments,Score
14n378b,https://www.cnbc.com/2023/06/30/supreme-court-biden-student-loan-forgiveness-plan.html,Supreme Court strikes down student loan forgiveness plan,3031,11025
14o2pem,https://i.redd.it/95deby9rhe9b1.jpg,"When it dips to 400, buy calls",409,8185
14sra7g,https://i.redd.it/x9ao3kryufab1.jpg,tAkE mY MoNeY eLoN,508,7457
14q1z3k,https://i.redd.it/apd3etv8xu9b1.jpg,Anybody feel this pain?,402,6673
14qgwx5,https://i.redd.it/5jtfwblyly9b1.gif,options level 4 granted,227,6234
14oy5dm,https://v.redd.it/5sx6d9pp1m9b1,When she finds out you have Tesla calls 🥵,249,5514
14pgsxe,https://i.redd.it/99dqs128nq9b1.png,Have to love the consistency. Blackrock FTW!,266,5434
14rodnx,https://i.redd.it/l3q2qpj7v7ab1.jpg,every earnings call,103,4830
14rwraa,https://i.redd.it/imwg4dmdm9ab1.jpg,Tesla cybertruck spotted at Stanford near Tesla HQ. All in puts 😭,878,3874
14scjug,https://i.redd.it/1bys0g275dab1.jpg,"Sometimes, you don’t even have to read the headline.",226,3877
14rlw7v,https://i.redd.it/459t0hhke7ab1.png,Zuck did it again; chose a trademarked name with an existing product & website! Calls on whoever owns threads.com!,282,3816
14r1zlq,https://i.redd.it/mx8dqn2793ab1.jpg,The lengths I go to remain bullish on my portfolio…,69,3794
14ov51u,https://i.redd.it/cnsv64apfl9b1.png,Tesla Bears right now after that blowout delivery report,623,3528
14qpasg,https://i.redd.it/ekpehgxq70ab1.jpg,What keeps you at night,234,3400
14q0ofq,https://i.redd.it/mq56kkf4mu9b1.jpg,"Finally, somebody gets me",68,3371
14rl8w1,https://i.redd.it/o8gc8r1ha7ab1.png,"After Meta and Threads, Zuck's next inspiring product name leaked:",217,2667
14nf6af,https://www.forbes.com.au/news/uncategorized/apple-hits-3-trillion-market-value-and-could-soar-another-800-billion/,"Apple is now as valuable as Tesla, Berkshire Hathaway, Meta and Netflix - combined after hitting $3 trillion market value",339,2485
14pnfhm,https://v.redd.it/vffk22osyr9b1,Flashback 2010: Jim Cramer advises not to buy Tesla during it's IPO when the price was $1.13 (split adjusted),273,2398
14ru79f,https://v.redd.it/ip9ow27829ab1,Zuck did it again,169,1925
14qfmjq,https://v.redd.it/408dou8scy9b1,Me waiting for $RIVN to kill Tesla like the people on the internet told me,163,1890
14si6f7,https://news.yahoo.com/twitter-threatening-sue-meta-over-181843547.html,Twitter is threatening to sue Meta over Threads,577,1896
14poyqe,https://v.redd.it/r4tsbdb59s9b1,I gambled on the gays and the gays lost (GRND),158,1883
14n2lmi,https://v.redd.it/xjfj0tvd569b1,I can only lose 100% though,79,1644
14n4wdq,https://www.reddit.com/gallery/14n4wdq,"Way Up was SPY Puts, Way Down was SPY Puts. RIP my beautiful gains",544,1542
14nylh4,https://www.reddit.com/gallery/14nylh4,Man it was a long road back!,285,1488
14qvgkd,https://www.forbes.com.au/news/innovation/what-is-threads-metas-twitter-rival-app-set-to-launch-this-week/,Meta goes all in on 'Twitter killer' app Threads,445,1407
14nisb1,https://i.redd.it/p12ckalzg99b1.jpg,I thought it was gain porn.,101,1325
14okpbb,https://v.redd.it/hlvkwmu40j9b1,I Gotta Redo this frame by frame with F^CK Man now...,68,1303
14sum0l,https://v.redd.it/5nvslj8xkgab1,Perfect time to repost this as we are possibly heading for a major correction.,64,1398
14s2hrr,https://i.redd.it/1lfujbtv0bab1.jpg,Hindsight is 20/20,93,1257
14qbv81,https://i.redd.it/1zcz4rv7hx9b1.jpg,The only reason I will never touch TSMC,317,1235
14nhqf2,https://i.redd.it/jtg6u70l799b1.jpg,When you YOLO during power hour and you have a party that night.,39,1198
14qlcn9,https://i.redd.it/duptf8v9gz9b1.jpg,How the fuck can you be a bear,337,1150
14pytdb,https://i.redd.it/18v7srrl6u9b1.png,"After bagholding $TSLA for almost two years, finally out of the red.",240,1127
14p1hk9,https://i.redd.it/2yicwpchqm9b1.jpg,Most investors believe we are in a new bull market and there will be no recession in 2023,116,1011
14rbb92,https://i.redd.it/xl2b02q7j5ab1.jpg,$TSLL CALLS,184,929
14qskum,https://i.redd.it/9pssxxsav0ab1.jpg,God bless America. Reminder to take your profits.,123,922
14rur3l,https://v.redd.it/yin531zi59ab1,Reviewing WSB charts,30,902
14nsgpb,https://i.redd.it/4vsrvd4q6c9b1.jpg,WE ARE GAP FILLING TO SPY $460+ VERY SOON!! I WILL FINALLY HAVE 6 FIGS!!! DEATH TO BEARS!!,503,892
14r8gd8,https://i.redd.it/rx9jbj6jx4ab1.jpg,june fed minutes coming out today,63,806
14q6dmw,https://i.redd.it/ul547c5j0w9b1.jpg,Someone help.,324,786
14rhicv,https://www.reddit.com/r/wallstreetbets/comments/14rhicv/bull_indicators_from_cocaine_found_in_white_house/,Bull Indicators from Cocaine Found in White House?,243,785
14rru0w,https://i.redd.it/w95mr1xcj8ab1.jpg,The prophecy was foretold,61,790
14slc5c,https://i.redd.it/8edwcyh9qeab1.jpg,There’s a new EV Belle of the Ball,163,782
14schg4,https://i.redd.it/elioiifr4dab1.jpg,crushing your hopes and dreams,32,724
14r06o4,https://i.redd.it/4gx53kc8r2ab1.png,"If all your accounts look like this, it's a sell signal",124,707
14n5po8,https://i.redd.it/qo9dxtkqq69b1.png,Current Market made me realize,44,687
14qlc9i,https://v.redd.it/58y1eycmfz9b1,Bears after the last 7 months,50,615
14qysi4,https://www.reddit.com/r/wallstreetbets/comments/14qysi4/mortgage_catastrophe_brews_in_britain_as_millions/,Mortgage catastrophe brews in Britain as millions are pushed toward insolvency,203,594
14pmd53,https://i.redd.it/ig986fgnrr9b1.jpg,The world’s 500 richest people added $852bn to their fortunes in the first half of 2023.,168,577
14qoxgf,https://i.redd.it/sdegu53350ab1.png,Real estate top is in,148,568
14nr9k5,https://www.reddit.com/r/wallstreetbets/comments/14nr9k5/walmart_insiders_offloading_billions_in_wmt_stock/,Walmart insiders offloading billions in $WMT stock - Should we be worried?,320,570
14s7h2l,https://www.forbes.com.au/news/innovation/elon-musk-predicts-tesla-self-driving-cars-will-arrive-this-year/,Elon says Tesla Self-Driving Cars Will Arrive ‘This Year',546,564
14ps1ox,https://i.redd.it/mfysd3s0vs9b1.jpg,When you just got paid but the market is closed,48,526
14saqmv,https://www.reddit.com/r/wallstreetbets/comments/14saqmv/disney_is_fukt/,Disney is fukt,764,505
14nhb0s,https://v.redd.it/ug0jnczr399b1,Why have we never thought of this??,23,500
14pnt61,https://i.redd.it/wolp4yyi1s9b1.jpg,Longing Zimbabwe's stock market,100,492
14ph15x,https://www.ft.com/content/b6f06bde-17b0-4886-b465-b561212c96a9?emailId=a9462bb6-1c72-4499-8697-f0edd8bc6aab&segmentId=22011ee7-896a-8c4c-22a0-7603348b7f22,Apple forced to make major cuts to Vision Pro headset production plans,231,485
14rsvci,https://www.reddit.com/gallery/14rsvci,$NVDA puts- All in,192,477
14qoa0x,https://i.redd.it/oqn5ease00ab1.jpg,"Life, liberty and the pursuit of 0DTE",24,460
14ohiij,https://i.redd.it/ehmme4u72i9b1.jpg,Death Knell for $PYPL,255,436
14n0sqr,https://v.redd.it/91ruue2gq59b1,Interview with a WSB Member,33,435
14syarl,https://i.redd.it/7o5lmf03hhab1.jpg,Threads is the future bruh.😂,99,518
14q1zn2,https://www.reddit.com/r/wallstreetbets/comments/14q1zn2/mother_fucking_aliens_have_arrived_and_they_are/,Mother Fucking Aliens Have Arrived And They Are Investing In The Stock Market - Recession Canceled,99,421
14n3dz3,https://www.reddit.com/r/wallstreetbets/comments/14n3dz3/400_million_worth_of_virgin_galactic_spce_stock/,$400 million worth of Virgin Galactic (SPCE) stock to be sold in new offering by the company. DILUTION INCOMING!,130,398
14sgnx9,https://www.reddit.com/gallery/14sgnx9,On a nice run. $105k realized profit in 3 months. Bullish on PTON and RUN next if anybody wants to hit the casino with me,171,402
14rllj2,https://i.redd.it/vgrptc0wc7ab1.jpg,Luckily grabbed Tesla at its bottom,93,381
14samu3,https://i.redd.it/qoz98sm0tcab1.jpg,"Combine losses with my noob account are about 40k… ask me next time if you wanna inverse me. Diamond hand, 0dte apparently is not the way…",201,377
14nmma1,https://www.reuters.com/world/us/jpmorgan-board-member-jim-crown-dies-an-accident-2023-06-26/,"JPMorgan, General Dynamics board member Jim Crown dies in accident",158,379
14pjwtn,https://i.redd.it/jcy8kbf3br9b1.jpg,tesla deliveries 👀,79,373
14n2gxh,https://www.reddit.com/gallery/14n2gxh,$40k SPY gain overnight MERICA,68,368
14nwyki,https://www.reddit.com/r/wallstreetbets/comments/14nwyki/why_aapl_tsla_will_keep_climbing/,Why AAPL TSLA will keep climbing 🥦🥦🥦🥦🥦,352,347
14okgkc,https://i.redd.it/6rr91697ui9b1.gif,NVDA stock price and news about NVDA. Main action after 22 may,70,319
14sobnz,https://i.redd.it/n4jvurwv9fab1.jpg,The name of the company: Tesla Inc.,34,328
14qb0p3,https://professpost.com/billionaire-investor-barry-sternlicht-believes-that-a-substantial-drop-in-inflation-is-imminent-as-evidenced-by-the-decline-in-rents,"Billionaire investor Barry Sternlicht believes that a substantial drop in inflation is imminent, as evidenced by the decline in rents",175,307
14p7fc0,https://i.redd.it/zhow3va04o9b1.jpg,Controlthenarrative when he sees the Dumb Money trailer,33,309
14pp4w8,https://i.redd.it/98laoldjas9b1.jpg,RIVN $129K,178,308
14q3zm1,https://www.reddit.com/r/wallstreetbets/comments/14q3zm1/the_bull_market_is_just_starting/,The Bull Market is Just Starting,464,310
14orfd1,https://www.reddit.com/r/wallstreetbets/comments/14orfd1/is_nvidia_overvalued_avgo_boasts_62_higher_net/,"Is Nvidia Overvalued? AVGO Boasts 62% Higher Net Income than NVDA, Yet with a 65% Lower Market Cap?",298,306
14nlxos,https://i.redd.it/vubcmjjtaa9b1.png,When AI becomes less A than I,66,303
14njfit,https://www.reddit.com/r/wallstreetbets/comments/14njfit/hey_dipshits/,Hey Dipshits,87,289
14nwjza,https://www.reddit.com/r/wallstreetbets/comments/14nwjza/bear_porn/,Bear Porn,151,268
14owb47,https://www.reddit.com/gallery/14owb47,"Tale of the epic comeback…. Started with oil, ended with oil….",82,251
14orti5,https://v.redd.it/j9m7zi4kqk9b1,"It's the summer of love, baby !",27,246
14sncxr,https://i.redd.it/4ee343cj3fab1.jpg,A new challenger arrives,28,248
14nashx,https://i.redd.it/cm8hwkeeq79b1.jpg,"New daily record, getting close!",93,228
14n1h15,https://i.redd.it/nlkpmgwmx59b1.jpg,Find the one you can’t live without,10,225
14p4pcr,https://i.redd.it/n6733fpcgn9b1.jpg,when you forget to pay back marge,34,222
14pggll,https://i.redd.it/412l2jn7kq9b1.png,"Most Anticipated Earnings Releases for the week beginning July 3rd, 2023",163,220
14papl5,https://www.reddit.com/r/wallstreetbets/comments/14papl5/will_warren_buffets_death_affect_berkshire/,Will Warren Buffet's death affect Berkshire Hathaway?,253,202
14p52te,https://www.reddit.com/r/wallstreetbets/comments/14p52te/tesla_will_continue_to_be_the_dominant_ev_leader/,"tesla will continue to be the dominant ev leader, here’s why",363,199
14rcevp,https://www.reddit.com/gallery/14rcevp,"Last summer I bought a bunch of stock in CDPR(the publisher of the Witcher and Cyberpunk 2077), today, I briefly became cyberpunk'd",31,199
14nbbuu,https://i.redd.it/rwel4s48u79b1.jpg,Loss 800 Apple 7/7 put contracts,244,195
14sta0b,https://www.nytimes.com/2023/07/06/technology/threads-downloads-twitter.html,"Threads Becomes Most Rapidly Downloaded App, Raising Twitter’s Ire —— $META",80,198
14pt4eq,https://www.reddit.com/r/wallstreetbets/comments/14pt4eq/group_barbeque_thread_for_july_4th_2023/,"Group Barbeque Thread for July 4th, 2023",5802,183
14pjr3j,https://www.reuters.com/technology/amds-ai-chips-could-match-nvidias-offerings-software-firm-says-2023-06-30/,"AMD AI chips could match Nvidia offerings, software firm says",75,183
14sj6yt,https://v.redd.it/b0e8ovf3ceab1,"I’m not naming any $META names, but I think I know how this ends",23,180
14ps7jn,https://www.reddit.com/r/wallstreetbets/comments/14ps7jn/continued_claims_a_recession_indicator_with_a_100/,"Continued Claims - A recession indicator with a 100% perfect track record, has crossed the rubicon",164,162
14nbryb,https://www.reddit.com/gallery/14nbryb,Tim Apple $AAPL 40k YOLO🍎🍏,53,156
14onj3d,https://www.reddit.com/r/wallstreetbets/comments/14onj3d/spce_doomed_to_fail/,Spce doomed to fail,167,148
